[
  {
    "video_path": "./00191345.mp4",
    "labels": [
      "pushups - early stopping"
    ],
    "labels_descriptive": [
      "pushups - User stopped the exercise early"
    ],
    "split": "train"
  },
  {
    "video_path": "./00129204.mp4",
    "labels": [
      "pushups - legs on the floor"
    ],
    "labels_descriptive": [
      "pushups - User's legs are on the floor"
    ],
    "split": "train"
  },
  {
    "video_path": "./00211664.mp4",
    "labels": [
      "pushups - butt sinking"
    ],
    "labels_descriptive": [
      "pushups - User's butt is sinking"
    ],
    "split": "train"
  },
  {
    "video_path": "./00252077.mp4",
    "labels": [
      "pushups - deep",
      "pushups - very wide"
    ],
    "labels_descriptive": [
      "pushups - User is going too deep in their push-ups",
      "pushups - Hand placement is too wide"
    ],
    "split": "train"
  },
  {
    "video_path": "./00191433.mp4",
    "labels": [
      "squats - insufficient",
      "squats - shoulder-width"
    ],
    "labels_descriptive": [
      "squats - User is doing the exercise insufficiently",
      "squats - User's feet are shoulder width apart"
    ],
    "split": "train"
  },
  {
    "video_path": "./00208748.mp4",
    "labels": [
      "squats - back not straight",
      "squats - shallow",
      "squats - shoulder-width"
    ],
    "labels_descriptive": [
      "squats - User's back isn't straight",
      "squats - User's squats are too shallow",
      "squats - User's feet are shoulder width apart"
    ],
    "split": "train"
  },
  {
    "video_path": "./00040723.mp4",
    "labels": [
      "squats - shallow",
      "squats - shoulder-width",
      "squats - no obvious issue"
    ],
    "labels_descriptive": [
      "squats - User's squats are too shallow",
      "squats - User's feet are shoulder width apart",
      "squats - no obvious issue"
    ],
    "split": "train"
  },
  {
    "video_path": "./00205235.mp4",
    "labels": [
      "squats - 90 degrees",
      "squats - narrow",
      "squats - no obvious issue"
    ],
    "labels_descriptive": [
      "squats - User's squatting down to 90 degrees",
      "squats - User's legs and feet are too close together",
      "squats - no obvious issue"
    ],
    "split": "train"
  },
  {
    "video_path": "./00026168.mp4",
    "labels": [
      "standing ytw - torso parallel to the ground, thumbs pointed up"
    ],
    "labels_descriptive": [
      "standing ytw - User's torso is parallel to the ground and their thumbs are pointed up"
    ],
    "split": "train"
  },
  {
    "video_path": "./00025409.mp4",
    "labels": [
      "standing ytw - arms too low"
    ],
    "labels_descriptive": [
      "standing ytw - User's arms are too low"
    ],
    "split": "train"
  },
  {
    "video_path": "./00036790.mp4",
    "labels": [
      "standing ytw - not low enough"
    ],
    "labels_descriptive": [
      "standing ytw - User is not going low enough"
    ],
    "split": "train"
  },
  {
    "video_path": "./00190168.mp4",
    "labels": [
      "standing ytw - torso parallel to the ground, thumbs pointed up"
    ],
    "labels_descriptive": [
      "standing ytw - User's torso is parallel to the ground and their thumbs are pointed up"
    ],
    "split": "train"
  },
  {
    "video_path": "./external/MultiView/eed963ae5fb2b1f85756bc5bfb7a3a542e0d7eca46ddb0cd98db881d9b1c7f7b.mp4",
    "labels": [
      "bad"
    ],
    "labels_descriptive": [],
    "split": "train"
  },
  {
    "video_path": "./external/MultiView/9dc51a01f6d6a6e2fd35596fa74f8d1914de483a99c915484d512b1cf00082a8.mp4",
    "labels": [
      "bad"
    ],
    "labels_descriptive": [],
    "split": "train"
  },
  {
    "video_path": "./external/MultiView/40cf7568e2b3554a056b7781d1718999f3e50baa34236314ee82591f2b67a048.mp4",
    "labels": [
      "bad"
    ],
    "labels_descriptive": [],
    "split": "train"
  },
  {
    "video_path": "./external/DVIDS/1f7e9adb5216f0ef0e1cf203ae03fa8242737df2868020d994ee425ad448dd17.mp4",
    "labels": [],
    "labels_descriptive": [],
    "split": "train"
  },
  {
    "video_path": "./00276875.mp4",
    "labels": [
      "elbow plank - stopping early"
    ],
    "labels_descriptive": [
      "elbow plank - User stopped the exercise early"
    ],
    "split": "train"
  }
]